topic,description
business,"**Scope:** Company building, operations, management, hiring, leadership, and strategy."
ai-llms,"**Scope:** Large language models, AI agents, prompt engineering, RAG, model tooling, and agent workflows."
software-engineering,"**Scope:** Software development practices, architecture, dev tooling, coding workflows, and engineering operations."
hardware-homelab,"**Scope:** Hardware builds, servers, homelab, local infrastructure."
finance-investing,"**Scope:** Investing, markets, valuation, personal finance stacks, and financial strategy."
faith,"**Scope:** Religious teaching, sermons, faith‑based content."
